sentID.BTEC	split	lang	sent
14147	corpus-6-test-corpus-26-train	KHA	أعذرني. انا طالب كلية من اليابان. هل أنت طالب ان واي يو؟
14150	corpus-6-test-corpus-26-train	KHA	ممكن تورينا كيف انت قيمت الفكرة دي؟
14167	corpus-6-test-corpus-26-train	KHA	اكي، هل إنت بتعرف دكان تسجيل جيد قريب هنا؟
14168	corpus-6-test-corpus-26-train	KHA	كاش ول شحن؟
14174	corpus-6-test-corpus-26-train	KHA	شغال لشركة تجارية.
14175	corpus-6-test-corpus-26-train	KHA	دا عدم تهذيب تسأل الناس بجنوا كم.
14184	corpus-6-test-corpus-26-train	KHA	هل ديل واحدات ليفايس خمسمية وواحد اصليات؟
14195	corpus-6-test-corpus-26-train	KHA	ياتو زمن ممكن اخد حمام؟
14198	corpus-6-test-corpus-26-train	KHA	ما شكلك فوق الواحد و عشرين سنة.
14219	corpus-6-test-corpus-26-train	KHA	أنا شايف. حقيقة، عنده فلم سرعة عالية فيه. هل تمانع إذا طلعتوا؟
14224	corpus-6-test-corpus-26-train	KHA	اشتريته قبل شوية.
14232	corpus-6-test-corpus-26-train	KHA	ح اجيب واحد الآن.
14235	corpus-6-test-corpus-26-train	KHA	تمنية دولارات. و هنا بجي واحد أسى.
14242	corpus-6-test-corpus-26-train	KHA	من فضلك وريه مع المشتريات للجمارك في المطار.
14261	corpus-6-test-corpus-26-train	KHA	هل في اي متاجر شاملة عندهم تخفيضات الآن؟
14265	corpus-6-test-corpus-26-train	KHA	مشغل المكالمات، اديني محطة الاطفاء.
14266	corpus-6-test-corpus-26-train	KHA	عندي بطارية ميتة.
14289	corpus-6-test-corpus-26-train	KHA	اقيف في التقاطع الجاي.
14292	corpus-6-test-corpus-26-train	KHA	اوه، هندا ليه. و هل على اي واحد يملأ فورمة تصريح الجمارك دي؟
14304	corpus-6-test-corpus-26-train	KHA	و ممكن اشيل اسمك من فضلك؟
14306	corpus-6-test-corpus-26-train	KHA	هل تمانع إذا عملت مكالمة على حساب الطرف التاني؟
14311	corpus-6-test-corpus-26-train	KHA	الو. كيف انت؟
14317	corpus-6-test-corpus-26-train	KHA	وين قسم الترحيل؟
14336	corpus-6-test-corpus-26-train	KHA	ما اسم الزول البتتمني تتكلم معاه؟
14347	corpus-6-test-corpus-26-test	KHA	انا آسف، هو ما دخل في اللحظة.
14363	corpus-6-test-corpus-26-train	KHA	شوف دا، شوف دا. انت ح تقولي الفرق بين الشاب دا و الشاب داك في الحظ؟ محمد، اقيف، ح تقيف؟ انت ما بتمانع إذا نزلتك هنا. أنا متأخر. صديق، جميل ان لاقيتك، اوكي؟
14373	corpus-6-test-corpus-26-dev	KHA	هل غرفتك تطل على المدينة؟
14389	corpus-6-test-corpus-26-train	KHA	أي رسائل لي؟
14400	corpus-6-test-corpus-26-test	KHA	ما زال غالي شديد. ما ممكن اشيله بتلاتة دولارات؟
14402	corpus-6-test-corpus-26-train	KHA	دائرية غرفة في الخلف.
14403	corpus-6-test-corpus-26-dev	KHA	ح اخد قزازة خمرة.
14416	corpus-6-test-corpus-26-train	KHA	شكلك جميل.
14426	corpus-6-test-corpus-26-test	KHA	داير غرفة مزدوجة. كم سعر الغرفة لليلة؟
14434	corpus-6-test-corpus-26-train	KHA	هو على بعد تسعة وتسعين ميل.
14441	corpus-6-test-corpus-26-train	KHA	فينس و ليندا دايرين يقعدوا براهم، عشان كدا آسف لازم اقعد هنا الليلة.
14444	corpus-6-test-corpus-26-train	KHA	من فضلك خت العفش دا مربوط.
14448	corpus-6-test-corpus-26-train	KHA	اسمي ساتو.
14457	corpus-6-test-corpus-26-train	KHA	أنا بعرف نادي جاز قديم وسط المدينة.
14459	corpus-6-test-corpus-26-train	KHA	ح اخد الوجبة الثابتة دي.
14462	corpus-6-test-corpus-26-dev	KHA	داير أجرب نفس الصحن زي الواحد داك.
14475	corpus-6-test-corpus-26-train	KHA	ثم ح نشيله.
14477	corpus-6-test-corpus-26-train	KHA	هل دا بمشي فوق للسابق السادس؟
14478	corpus-6-test-corpus-26-dev	KHA	جلد تمساح؟
14483	corpus-6-test-corpus-26-train	KHA	من فضلك خته في شنطة غسيل و خليه هناك.
14484	corpus-6-test-corpus-26-train	KHA	داير الفلم دا يتطور. متين ح يكون جاهز؟
14495	corpus-6-test-corpus-26-dev	KHA	من فضلك ما تدي المفتاح دا لأي زول تاني غيري.
14500	corpus-6-test-corpus-26-test	KHA	اوكي. ح ارفعك من فندقك عند الساعة تمنية.
14502	corpus-6-test-corpus-26-train	KHA	شباك تمام.
14505	corpus-6-test-corpus-26-train	KHA	خلي قصتي لتحت، لو سمحت.
14507	corpus-6-test-corpus-26-train	KHA	هل كل مصروفات الترحيل اتضمنت؟
14509	corpus-6-test-corpus-26-train	KHA	منزل ميتروبولتان اوبرا.
14514	corpus-6-test-corpus-26-train	KHA	وين مكتب أجر-عربية؟
14519	corpus-6-test-corpus-26-dev	KHA	أنا محموم من الليلة الفاتت.
14520	corpus-6-test-corpus-26-train	KHA	هو ما مذاقي.
14530	corpus-6-test-corpus-26-train	KHA	ياتو خضروات عندك؟
14531	corpus-6-test-corpus-26-test	KHA	داير كيرلي خفيف.
14534	corpus-6-test-corpus-26-train	KHA	متين بجي الدكتور؟
14537	corpus-6-test-corpus-26-train	KHA	هو اللون الغلط.
14538	corpus-6-test-corpus-26-train	KHA	السن اتكسرت.
14542	corpus-6-test-corpus-26-train	KHA	هل دا مقعد ممر ول مقعد شباك؟
14557	corpus-6-test-corpus-26-train	KHA	أنا في المشي.
14564	corpus-6-test-corpus-26-dev	KHA	بتقدر توصل شنطتي للغرفة؟
14573	corpus-6-test-corpus-26-train	KHA	وريني واحد لسيدة شابة.
14590	corpus-6-test-corpus-26-train	KHA	ممكن تقيف هنا؟
14593	corpus-6-test-corpus-26-dev	KHA	عندك اي شي بحوالي تمنين دولار بالظبط؟
14605	corpus-6-test-corpus-26-train	KHA	انا عطشان.
14612	corpus-6-test-corpus-26-train	KHA	لبن لا، من فضلك.
14683	corpus-6-test-corpus-26-dev	KHA	عندي تلات شنط.
14685	corpus-6-test-corpus-26-train	KHA	وين البحيرة؟
14693	corpus-6-test-corpus-26-test	KHA	اعزرني، اضغط زر التصوير، من فضلك.
14709	corpus-6-test-corpus-26-train	KHA	ممكن اخد مجلة ول حاجة؟
14718	corpus-6-test-corpus-26-train	KHA	إنه الجنوب.
14721	corpus-6-test-corpus-26-train	KHA	كم سعر مقاعد البلكونة؟
14734	corpus-6-test-corpus-26-test	KHA	دايرين غرفة كاشفة البحيرة.
14737	corpus-6-test-corpus-26-train	KHA	هل في صناديق بريد قريب من هنا؟
14757	corpus-6-test-corpus-26-train	KHA	كله تمام. ح آخدك هناك.
14761	corpus-6-test-corpus-26-train	KHA	الجزء المكتوب بميل يشير للتغييرات في تسعينات القرن العشرين.
14763	corpus-6-test-corpus-26-train	KHA	عمره تلاتين سنة.
14777	corpus-6-test-corpus-26-test	KHA	كله تمام. ممكن تكتب العنوان مرة تانية في الظرف دا؟
14783	corpus-6-test-corpus-26-train	KHA	داير أمشي لي الهارودس. ممكن ترسم خريطة، من فضلك؟
14786	corpus-6-test-corpus-26-train	KHA	ماذا تفعل لم يكون عندك زمن بديل؟
14789	corpus-6-test-corpus-26-train	KHA	هل عندك بطاريات للكاميرا دي؟
14805	corpus-6-test-corpus-26-train	KHA	داير كيبل للتصوير عن بعد.
14807	corpus-6-test-corpus-26-train	KHA	هل انت الأخير في الصف؟
14810	corpus-6-test-corpus-26-train	KHA	أعتقد أنه محجوز زيادة.
14813	corpus-6-test-corpus-26-train	KHA	طلقة جيدة. بس برة.
14818	corpus-6-test-corpus-26-train	KHA	ممكن توريني أماكن الاهتمام هنا؟
14820	corpus-6-test-corpus-26-train	KHA	هل في أي متاجر شاملة قريبة من هنا؟
14854	corpus-6-test-corpus-26-dev	KHA	انا برضوا.
14862	corpus-6-test-corpus-26-train	KHA	داير انضم من سان دييغو.
14863	corpus-6-test-corpus-26-train	KHA	كنت بفكر في اخد الكورس داك السمستر الجاي.
14887	corpus-6-test-corpus-26-train	KHA	الخمرة ما باردة كفاية. ممكن تبردها اكتر؟
14901	corpus-6-test-corpus-26-dev	KHA	هل ممكن تبدل الحلق ده الى كليبسات؟
14903	corpus-6-test-corpus-26-train	KHA	شنو اكتر شي مهتم بيه الآن؟
14905	corpus-6-test-corpus-26-train	KHA	داير إعادة دفع . ممكن احصل علي قروشي راجعة؟
14926	corpus-6-test-corpus-26-train	KHA	أنا احتمال ما اقدر ألقى مشروب زي دا في أي مكان تاني.
14933	corpus-6-test-corpus-26-train	KHA	إذا اشتريت دا برضه، ح يعمل القيمة المعفاة من الضرائب.
14952	corpus-6-test-corpus-26-train	KHA	ممكن اشوف شهادة التطعيم حقتك، من فضلك؟
14960	corpus-6-test-corpus-26-train	KHA	هل انت بتسافر كتير؟
14969	corpus-6-test-corpus-26-train	KHA	انا جاي من الولايات. المتحدة.
14976	corpus-6-test-corpus-26-train	KHA	عندي تزكرة جوية لسان فرانسيسكو.
14998	corpus-6-test-corpus-26-train	KHA	إذا هو فقط خمسين دقيقة من المحطة، ادا ح أمشي.
15019	corpus-6-test-corpus-26-train	KHA	داير فندق أرخص شوية.
15020	corpus-6-test-corpus-26-test	KHA	بونساي شكله زي هواية زول قديم.
15024	corpus-6-test-corpus-26-dev	KHA	ما قررت لسة. ممكن تديني زمن اكتر شوية؟
15025	corpus-6-test-corpus-26-train	KHA	عندي صداع.
15036	corpus-6-test-corpus-26-dev	KHA	ممكن تنضم لي لقهوة؟
15037	corpus-6-test-corpus-26-train	KHA	داير شهادة طبية و ايصال لتأميني.
15046	corpus-6-test-corpus-26-test	KHA	اوه، لا. من فضلك أسرع. نحن متأخرين.
15051	corpus-6-test-corpus-26-train	KHA	ما داير انفق اكتر من عشرين دولار.
15062	corpus-6-test-corpus-26-train	KHA	لي الرحلة ما بتقلع؟ وريني الحاصل شنو.
15073	corpus-6-test-corpus-26-test	KHA	كم سعر الأجرة؟ ممكن تكتب الأجرة برة في قطعة ورقة؟
15083	corpus-6-test-corpus-26-train	KHA	دير أأجر كرسي سطح.
15087	corpus-6-test-corpus-26-train	KHA	انتظر دقيقة، من فضلك.
15088	corpus-6-test-corpus-26-test	KHA	هل مفروض السيدات يلبسوا فساتين رسمية؟
15095	corpus-6-test-corpus-26-train	KHA	ما تهبشني.
15109	corpus-6-test-corpus-26-train	KHA	هل عندك سجائر؟
15123	corpus-6-test-corpus-26-train	KHA	اذا الرياح ما قوية شديد، ممكن نمشي لتيكي بوينت.
15126	corpus-6-test-corpus-26-train	KHA	رائع.
15133	corpus-6-test-corpus-26-train	KHA	ح اقفل الآن. شكرا ليك لانتباهك.
15145	corpus-6-test-corpus-26-dev	KHA	هل عندك دا بأي لون تاني؟
15149	corpus-6-test-corpus-26-train	KHA	من هو؟
15157	corpus-6-test-corpus-26-train	KHA	اعزرني. ممكن توريني وين موقف التكسي؟
15170	corpus-6-test-corpus-26-train	KHA	و الشراب؟
15181	corpus-6-test-corpus-26-train	KHA	هندا ليه.
15201	corpus-6-test-corpus-26-train	KHA	وين أقرب متجر أجهزة؟
15206	corpus-6-test-corpus-26-train	KHA	هممم. ما شغال، ول لا؟ ممكن تحركه لمقعد فاضي، إذا داير.
15221	corpus-6-test-corpus-26-train	KHA	انا بفتش لي دا.
15240	corpus-6-test-corpus-26-train	KHA	كله تمام سيدي. و تحب شنو للتحلية؟
15246	corpus-6-test-corpus-26-train	KHA	عربة عادية ول بولمان؟
15247	corpus-6-test-corpus-26-train	KHA	شيكات سياحية . شكرا ليك . دي تزكرتك و بطاقة ركوبك . كن هناك، من فضلك، قبل ساعة من زمن الرحلة.
15257	corpus-6-test-corpus-26-test	KHA	هو ألم حاد.
15259	corpus-6-test-corpus-26-train	KHA	الاسم جورو موتوياما. و الرقم صفر تلاتة تلاتة اتنين ستة واحد اتنين أربعة تسعة خمسة.
15262	corpus-6-test-corpus-26-train	KHA	حاسس انى عيان جدا.
15274	corpus-6-test-corpus-26-train	KHA	"ما هي أوقات العرض ل""كوسيس لف""؟"
15283	corpus-6-test-corpus-26-train	KHA	كلو تمام. ح تاخد قهوتك أسى ول لاحقا؟
15292	corpus-6-test-corpus-26-train	KHA	وريني اسخن نادي ريقي في نيويورك.
15295	corpus-6-test-corpus-26-test	KHA	في ياتو طريقة منتجك مختلف من منافسينك؟
15296	corpus-6-test-corpus-26-train	KHA	هل اوكي ان مافي زول بسمع تعليمات الأمان؟
15319	corpus-6-test-corpus-26-train	KHA	هل طريق خلفي خطر؟
15320	corpus-6-test-corpus-26-train	KHA	نعم، من فضلك اخد الإجراء الضروري.
15323	corpus-6-test-corpus-26-train	KHA	نعم، واحد بس. متين ح اعرف؟ كيف ح أكون اتعوضت؟
15331	corpus-6-test-corpus-26-dev	KHA	هنا بطاقتي التعريفية.
15337	corpus-6-test-corpus-26-train	KHA	بنفضل طربيزة على الشباك.
15347	corpus-6-test-corpus-26-train	KHA	من فضلك وريني الطريقة الارخص للمشي لسان فرانسيسكو.
15362	corpus-6-test-corpus-26-train	KHA	هل بتعرف الكافيتيريا، كيويا؟
15378	corpus-6-test-corpus-26-train	KHA	اتجاه واحد.
15380	corpus-6-test-corpus-26-train	KHA	أنا ح ابقى سمين بس قاعد هنا أكل باستمرار.
15400	corpus-6-test-corpus-26-train	KHA	هل هناك نادي ليلى جيد مع عرض فلامنجو؟
15419	corpus-6-test-corpus-26-train	KHA	داك فستان جميل فيك.
15431	corpus-6-test-corpus-26-train	KHA	رجلي تؤلم.
15436	corpus-6-test-corpus-26-train	KHA	وين أقرب مغسلة؟
15443	corpus-6-test-corpus-26-train	KHA	ممكن تبدل المقاعد معاي، من فضلك؟
15447	corpus-6-test-corpus-26-train	KHA	مقاعدنا اتفصلت.
15452	corpus-6-test-corpus-26-train	KHA	بالتأكيد، داير احصل علي الحزمة دي مأمنة برضه.
15463	corpus-6-test-corpus-26-train	KHA	الفاتورة تجي مية دولار.
15464	corpus-6-test-corpus-26-test	KHA	مخارج الطوارئ موضوعة في الأمام، النص، و خلف الطائرة دي.
15470	corpus-6-test-corpus-26-train	KHA	كلوا تمام، حجزك تم إعادة تأكيده.
15476	corpus-6-test-corpus-26-train	KHA	الكعوب عالية شديد.
15477	corpus-6-test-corpus-26-train	KHA	دايرين طربيزة في الشرفة.
15482	corpus-6-test-corpus-26-train	KHA	بيعني ان الفلم احتمال ما يكون مناسب للأطفال أقل من خمستاشر. عشان كدا الوالدين بحتاجوا يختوا في الاعتبار سواء يخلوا الأطفال يحضروا الفلم.
15487	corpus-6-test-corpus-26-train	KHA	كيف داير القروش؟ من فضلك املأ الورقة دي و وقع هنا.
15509	corpus-6-test-corpus-26-train	KHA	أحيانا بطني بتوجع.
15522	corpus-6-test-corpus-26-train	KHA	هل عندك أطباق منخفضة السعرات الحرارية؟ انا في حمية أسى.
15529	corpus-6-test-corpus-26-dev	KHA	ما ضروري الشحن.
15539	corpus-6-test-corpus-26-train	KHA	نعم، أنا عندي تزكرتين للجيانتس و دودقرس.
15546	corpus-6-test-corpus-26-train	KHA	نحن واحد من قمة الموردين بتاعين المايكروكمبيوترات.
15553	corpus-6-test-corpus-26-train	KHA	شكرا ليك. أنا برضه. مع السلامة لغاية الوقت داك.
15564	corpus-6-test-corpus-26-train	KHA	غرفة مزدوجة مع حمام، من فضلك.
15566	corpus-6-test-corpus-26-train	KHA	أنا وقعت على السلالم.
15575	corpus-6-test-corpus-26-train	KHA	ياتو اسكريم انت بتزكي؟
15577	corpus-6-test-corpus-26-dev	KHA	اممم. الواحد دا. اللون شكله سمح عليك.
15598	corpus-6-test-corpus-26-test	KHA	وين كتب اللغة الأجنبية؟
15604	corpus-6-test-corpus-26-train	KHA	شريحتين و اسبرايت.
15607	corpus-6-test-corpus-26-test	KHA	اديني بعض السجائر.
15610	corpus-6-test-corpus-26-dev	KHA	غير قانوني انك تجيبه في البلد - آسف . طيب، أظن داك ي كل شي.
15652	corpus-6-test-corpus-26-train	KHA	نعم، أنا هو. اعتادوا يسكنوا جنبي في كاليفورنيا لكن انتقلت الى فلوريدا قبل سنتين. كيف عنك انت؟ هل بتسافر براك؟
15664	corpus-6-test-corpus-26-train	KHA	انا عيان.
15666	corpus-6-test-corpus-26-train	KHA	طفلي شكله مرهق نتيجة الحمى.
15673	corpus-6-test-corpus-26-train	KHA	في المقاس دا، من فضلك.
15674	corpus-6-test-corpus-26-train	KHA	درجات المزايا الثقافية يبدوها لفنانين وعلماء مميزين في اليوم داك.
15676	corpus-6-test-corpus-26-train	KHA	انا ياباني. سعر الغرفة هو ستة ألف ين لليلة.
15692	corpus-6-test-corpus-26-train	KHA	داك غالي شديد.
15699	corpus-6-test-corpus-26-train	KHA	نعم. اخد البص البمشي لي كيوتوايكي.
15710	corpus-6-test-corpus-26-train	KHA	هل هو للأعضاء فقط؟
15735	corpus-6-test-corpus-26-dev	KHA	سعر الغرفة هو ستة ألف ين لليلة.
15763	corpus-6-test-corpus-26-train	KHA	ممكن اجيب دا في ركوب الطيارة؟
15775	corpus-6-test-corpus-26-train	KHA	اوكي. كل الداير أعرفه ما إذا كان العمل أبدا ح يدفع بطريقته.
15784	corpus-6-test-corpus-26-train	KHA	تمام. داير وشاح عشان يمشي مع داك؟
15788	corpus-6-test-corpus-26-train	KHA	أعد شحن البطاريه، من فضلك.
15791	corpus-6-test-corpus-26-train	KHA	انا جاهز للطلب.
15798	corpus-6-test-corpus-26-dev	KHA	أملاح الحمام العشبي بتخلي بشرتك تحس ناعمة و ملساء.
15804	corpus-6-test-corpus-26-train	KHA	اكتب اسم الخطوط الجوية و رقم الرحلة، برضه.
15814	corpus-6-test-corpus-26-train	KHA	حقيقة. اليوم هو الأحد، و الأحد اكعب يوم.
15896	corpus-6-test-corpus-26-train	KHA	نعم، هي مشكلة عدم تصرف.
15897	corpus-6-test-corpus-26-train	KHA	داير الشكل دا في وضع خمسة أماكن.
15899	corpus-6-test-corpus-26-train	KHA	أسر كثيرة عندهم دخول مزدوجة.
15902	corpus-6-test-corpus-26-train	KHA	"اوه. الفضة دي نادرة ""القمر و الجرس"" . اكيد داير تبادلا؟"
15911	corpus-6-test-corpus-26-train	KHA	أمي و اختي جاين من اليابان عشان يشوفوني . ح يوصلوا حوالي سبعة في المساء.
15942	corpus-6-test-corpus-26-train	KHA	البني شعبي جدا السنة دي.
15950	corpus-6-test-corpus-26-test	KHA	فكرة جيدة. متين مخطط تجي؟
15967	corpus-6-test-corpus-26-train	KHA	أوكي. مقعدين، من فضلك.
15989	corpus-6-test-corpus-26-train	KHA	وين السوق؟
16007	corpus-6-test-corpus-26-train	KHA	أنا بفتش لطريقة لتجريب بدلة السباق حقتي.
16016	corpus-6-test-corpus-26-train	KHA	أنا اعتقدت ي شباب أنكم اكلتوا دونات.
16034	corpus-6-test-corpus-26-train	KHA	كم تكلفة تزكرة درجة أولى إلى ادينبيره، من فضلك؟
16042	corpus-6-test-corpus-26-train	KHA	يبدو أن القروش الاديتني ليها أقل بعشرة دولارات.
16046	corpus-6-test-corpus-26-train	KHA	انا اتصلت بي مستر اسميث في الغرفة اتنين صفر واحد، لكن ما كان في رد. ممكن تعرف إذا هو لسة قاعد هنا؟
16061	corpus-6-test-corpus-26-train	KHA	داير واحد حديث.
16070	corpus-6-test-corpus-26-train	KHA	أنا شغال لشركة نشر.
16073	corpus-6-test-corpus-26-train	KHA	ممكن من فضلك تملأ دا؟
16080	corpus-6-test-corpus-26-test	KHA	ياتو شارع دا؟
16082	corpus-6-test-corpus-26-test	KHA	ممكن توزن الحزمة دي؟
16089	corpus-6-test-corpus-26-train	KHA	ماذا تسمى داك بالانجليزي؟
16091	corpus-6-test-corpus-26-train	KHA	واصل المشي في الممر دا، ثم ح تلقاه على الجانب اليمين.
16098	corpus-6-test-corpus-26-train	KHA	داير أأكد دا.
16106	corpus-6-test-corpus-26-train	KHA	صباح الخير. مكتب الاستقبال. ممكن اساعدك؟
16127	corpus-6-test-corpus-26-train	KHA	كلو تمام. من فضلك خش.
16130	corpus-6-test-corpus-26-test	KHA	نعم، سيدي. انا بجي للفطور هنا كل يوم، من الاتنين للجمعة، قبل أمشي الشغل.
16140	corpus-6-test-corpus-26-dev	KHA	ما مشكلة.
16141	corpus-6-test-corpus-26-train	KHA	من فضلك اديني تلاتة اتنين ستة اتنين تسعة واحد تمنية.
16158	corpus-6-test-corpus-26-train	KHA	نعم، ممكن نخدمك من سبعة.
16167	corpus-6-test-corpus-26-train	KHA	من فضلك ارقد هنا.
16169	corpus-6-test-corpus-26-test	KHA	ما اسرعها من خدمة.
16191	corpus-6-test-corpus-26-train	KHA	هو ح يظهر.
16217	corpus-6-test-corpus-26-train	KHA	من فضلك لف شمال في التقاطع الجاي.
16219	corpus-6-test-corpus-26-dev	KHA	اعزرني. كيف أوصل البنك؟
16222	corpus-6-test-corpus-26-train	KHA	هل هناك خدمة بص إلى فورد ميوسيم؟
16227	corpus-6-test-corpus-26-train	KHA	نعم. اسمك و رقم غرفتك، من فضلك.
16231	corpus-6-test-corpus-26-train	KHA	كم من الزمن تستغرق عشان يوصل اليابان بالبريد الجوي؟
16238	corpus-6-test-corpus-26-train	KHA	أوكي. اشوفك عند الثانية في الأحد.
16258	corpus-6-test-corpus-26-train	KHA	داير أمشي خلال نيويورك إلى تورونتو.
16259	corpus-6-test-corpus-26-train	KHA	السوستة مكسورة، هل عندك زيادة في المثل؟
16271	corpus-6-test-corpus-26-train	KHA	دا نوع من الوساخة.
16279	corpus-6-test-corpus-26-dev	KHA	ممكن تعيد تأكيد رحلتي؟ هنا دي تزكرتي بتاعت الخطوط الجوية.
16291	corpus-6-test-corpus-26-train	KHA	هل عندك دا في أخضر غامض؟
16292	corpus-6-test-corpus-26-test	KHA	هل ح تاخدني لكانتربيري و تجيبني راجع؟
16311	corpus-6-test-corpus-26-train	KHA	ممكن احصل علي شوكة جديدة؟
16312	corpus-6-test-corpus-26-train	KHA	شكرا ليك كتير للطفك.
16335	corpus-6-test-corpus-26-train	KHA	سوري، ما بنبيع تزاكر للمسرح.
16337	corpus-6-test-corpus-26-train	KHA	داير اشوف دا.
16339	corpus-6-test-corpus-26-train	KHA	اوه، داك جميل. مفروض اعمل شنو؟
16344	corpus-6-test-corpus-26-dev	KHA	داير امدد إقامتي هنا ليومين زيادة.
16351	corpus-6-test-corpus-26-train	KHA	من فضلك غير مقعدي.
16365	corpus-6-test-corpus-26-train	KHA	عندنا بعض الجمبري الجيد اليوم.
16371	corpus-6-test-corpus-26-train	KHA	لياتو تأخير هو بفتح؟
16395	corpus-6-test-corpus-26-train	KHA	مدخن ول لا؟
16403	corpus-6-test-corpus-26-train	KHA	هو غالي شديد لي. ما ممكن تعمله ارخص؟
16409	corpus-6-test-corpus-26-dev	KHA	انا بفتح في صباح الأربعاء أو الجمعة بعد الظهر.
16413	corpus-6-test-corpus-26-train	KHA	أنا ما عملت حجز.
16434	corpus-6-test-corpus-26-train	KHA	لأن الصيف في اليابان عادة سخن شديد، و نحن ما عندنا مكيف هواء في الأيام القديمة.
16444	corpus-6-test-corpus-26-train	KHA	ممكن تنادي لي تاكسي صباح بكرة؟
16453	corpus-6-test-corpus-26-train	KHA	إنه شرير.
16465	corpus-6-test-corpus-26-train	KHA	لي ما ننتظر البص في المظلة؟
16477	corpus-6-test-corpus-26-train	KHA	تعال، كينجي. خليني أوريك حول المكتب.
16478	corpus-6-test-corpus-26-train	KHA	نعم، هو مفتوح من تسعة لتسعة.
16484	corpus-6-test-corpus-26-dev	KHA	انا ما بقدر انوم كويس بالليل.
16487	corpus-6-test-corpus-26-train	KHA	كيف أثر الركود في العمل؟
16495	corpus-6-test-corpus-26-train	KHA	عندي موعد تاني.
16516	corpus-6-test-corpus-26-train	KHA	ممكن احصل علي خريطة شارع؟
16536	corpus-6-test-corpus-26-dev	KHA	الشئ الكنت بفتش فيه.
16542	corpus-6-test-corpus-26-train	KHA	انا ما فاهم توضيحاتك.
16546	corpus-6-test-corpus-26-train	KHA	مفروض يعمل اتصال. ماشي لبوسطن.
16547	corpus-6-test-corpus-26-train	KHA	وين أحسن مكان للسياحة؟
16576	corpus-6-test-corpus-26-train	KHA	هو متين؟
16577	corpus-6-test-corpus-26-train	KHA	انا استمتعت جدا.
16581	corpus-6-test-corpus-26-train	KHA	طيب تمام، داير يكون عندي وش أصغر زي جوليا روبرتس.
16586	corpus-6-test-corpus-26-train	KHA	ممكن تشيل دا، من فضلك؟
