sentID.BTEC	split	lang	sent
11450	corpus-6-test-corpus-26-train	KHA	دايرك تزحه.
11457	corpus-6-test-corpus-26-train	KHA	أمشي شمال بالشارع دا و اخد أول يمين.
11462	corpus-6-test-corpus-26-train	KHA	داير أعرف إذا ممكن احصل على الطقم دا من الصحون مشحون لطوكيو.
11467	corpus-6-test-corpus-26-train	KHA	داير بعض قوة الجسد.
11478	corpus-6-test-corpus-26-train	KHA	هل هناك أي طعام ما حار شديد و سبايسي؟
11479	corpus-6-test-corpus-26-train	KHA	هل هو قريب كفاية للمشي؟
11491	corpus-6-test-corpus-26-dev	KHA	داير بعض كريم اليد.
11493	corpus-6-test-corpus-26-train	KHA	ممكن تمرر لي الملح؟
11500	corpus-6-test-corpus-26-train	KHA	داير أمشي لى وول استريت. كيف اوصل هناك؟
11541	corpus-6-test-corpus-26-train	KHA	تمارين كتيرة شديد ح تاذيك.
11544	corpus-6-test-corpus-26-train	KHA	متضمن الفطور، ضرائب، و رسوم خدمة، ح تكون خمسة وأربعين دولار للنفر الواحد.
11550	corpus-6-test-corpus-26-train	KHA	ممكن تصلح دا؟
11574	corpus-6-test-corpus-26-train	KHA	مساء الخير . اهلا.
11576	corpus-6-test-corpus-26-train	KHA	ما قادر ألقى عفشك.
11595	corpus-6-test-corpus-26-train	KHA	أمشي دغري، من فضلك.
11600	corpus-6-test-corpus-26-train	KHA	هل الموية هنا صالحة للشرب؟
11622	corpus-6-test-corpus-26-train	KHA	اااه، ياللا. دولارين فقط.
11626	corpus-6-test-corpus-26-train	KHA	ممكن من فضلك تغير الفستان دا لواحد مقاس أكبر؟
11631	corpus-6-test-corpus-26-train	KHA	طيب، خلينا نمشي. ممكن اساعدك في واجبك المنزلي بعد ناخد بعض البيتزا.
11633	corpus-6-test-corpus-26-train	KHA	نعم، مستر. تاناكا. هناك في رسالتين ليك.
11643	corpus-6-test-corpus-26-train	KHA	ما بناسبني.
11646	corpus-6-test-corpus-26-train	KHA	بكرة يوم آخر.
11663	corpus-6-test-corpus-26-train	KHA	ربما اقدر اساعدك. هل أنت محتاج لفيتامين سي؟
11689	corpus-6-test-corpus-26-train	KHA	محفظتي إتنشلت في القطر.
11704	corpus-6-test-corpus-26-train	KHA	هو بعيد جدا. أحسن تاخد تكسي.
11708	corpus-6-test-corpus-26-train	KHA	داير مقعد ممر، من فضلك.
11709	corpus-6-test-corpus-26-train	KHA	ساكن في شقة بتمنين ألف ين في الشهر.
11714	corpus-6-test-corpus-26-train	KHA	ممكن أقاطع؟
11720	corpus-6-test-corpus-26-dev	KHA	وريني واحد أوسع.
11734	corpus-6-test-corpus-26-train	KHA	اعزرني. ممكن تبدل المقاعد معاي؟
11746	corpus-6-test-corpus-26-train	KHA	نعم، طبعا.
11751	corpus-6-test-corpus-26-train	KHA	أمشي للكورنة و لف شمال عند الإشارة.
11754	corpus-6-test-corpus-26-dev	KHA	هل بتحب دحروجات صغيرة ول واحدات أكبر؟
11767	corpus-6-test-corpus-26-test	KHA	داير غرفة سنقل مع حمام بتمنين دولار، من فضلك.
11800	corpus-6-test-corpus-26-train	KHA	داير أودع أشيائي القيمة في خزنة الفندق.
11817	corpus-6-test-corpus-26-dev	KHA	عندك غرفة متاحة لي الليلة؟
11821	corpus-6-test-corpus-26-train	KHA	نعم، بس أتأكد ان عندك تزكرتك معاك.
11862	corpus-6-test-corpus-26-train	KHA	فقط ناس بسيطين ح ينضموا للجولة الاختيارية.
11872	corpus-6-test-corpus-26-train	KHA	ما تهم. على كل حال، من فضلك وديني للمركز بتاع شايناتاون، ح أحاول ألقاه بنفسي.
11879	corpus-6-test-corpus-26-train	KHA	ناس جداد اتعينوا في أبريل.
11880	corpus-6-test-corpus-26-train	KHA	أتمنى ذلك.
11885	corpus-6-test-corpus-26-train	KHA	اتنين سكوتش و موية، من فضلك.
11901	corpus-6-test-corpus-26-train	KHA	من اللاعب؟
11913	corpus-6-test-corpus-26-dev	KHA	ممكن تتصل على إذا لقيت شنطي؟
11916	corpus-6-test-corpus-26-train	KHA	للشمال، من فضلك.
11932	corpus-6-test-corpus-26-test	KHA	ممكن تقيف معاي لصورة؟
11938	corpus-6-test-corpus-26-dev	KHA	لا، داير تقيده؟
11949	corpus-6-test-corpus-26-train	KHA	السن دي الفي الأمام بتوجع.
11959	corpus-6-test-corpus-26-train	KHA	ما هي آخر لعبة كمبيوتر لعمر خمستاشر سنة؟
11972	corpus-6-test-corpus-26-train	KHA	ح نشوفك بكرة.
11973	corpus-6-test-corpus-26-test	KHA	هل هناك كافيتريا أقل غلاء قريب من هنا؟
11975	corpus-6-test-corpus-26-train	KHA	لا، لكن شكرا. انا حاسي أحسن.
11976	corpus-6-test-corpus-26-train	KHA	هل عندك اي عيش؟
11977	corpus-6-test-corpus-26-train	KHA	كيف اجادتك للكمان؟
11990	corpus-6-test-corpus-26-train	KHA	صحبي اتزلق و وقع في الحمام.
11991	corpus-6-test-corpus-26-train	KHA	ممكن اخد طفاية؟
11997	corpus-6-test-corpus-26-train	KHA	المسيحية كانت محظورة و البلد كانت مقفولة من باقي العالم.
12005	corpus-6-test-corpus-26-train	KHA	داير كم انت؟
12012	corpus-6-test-corpus-26-train	KHA	كوكتيل جمبري ليها و نفس الشي لي أنا.
12033	corpus-6-test-corpus-26-train	KHA	ممكن اخليك توقع هنا؟ و من فضلك بداية هنا.
12035	corpus-6-test-corpus-26-train	KHA	إنها سعادة عظيمة لي أن أزور مكاتبك الرئيسية و احصل علي نقاش كبير معاك. شكرا ليك كتير لتعاونك الطيب.
12054	corpus-6-test-corpus-26-train	KHA	شخيرك مزعج.
12056	corpus-6-test-corpus-26-train	KHA	ما بحب اللون بعد دا كله. ممكن أرجع دا؟
12057	corpus-6-test-corpus-26-dev	KHA	اطلع برة الباب داك هناك، و انتظر في الموقف رقم ستة.
12060	corpus-6-test-corpus-26-dev	KHA	جداد مشوي، من فضلك.
12069	corpus-6-test-corpus-26-train	KHA	ممكن احصل على بعض الفلفل؟
12074	corpus-6-test-corpus-26-test	KHA	أيوة، داير حاجة اقراها.
12101	corpus-6-test-corpus-26-train	KHA	معاك مستر تاكاباشي في غرفة خمسة تسعة وأربعين. ممكن ترسل أربعة قارورات من بيرة براوزر، من فضلك؟
12131	corpus-6-test-corpus-26-train	KHA	دي سبعين دولار.
12140	corpus-6-test-corpus-26-train	KHA	من فضلك اتصل على فندقي لم تلقى شنطي.
12150	corpus-6-test-corpus-26-train	KHA	داير مكالمة إيقاظ عند تمنية و تلاتين صباحا، من فضلك.
12167	corpus-6-test-corpus-26-train	KHA	أيوة، لكن دا كتير شديد و انا اساسا ملان.
12172	corpus-6-test-corpus-26-train	KHA	داير بعض غسول الفم.
12173	corpus-6-test-corpus-26-train	KHA	ما حاسي تمام.
12182	corpus-6-test-corpus-26-train	KHA	هل انت بتدي اي تخفيض كبير؟
12193	corpus-6-test-corpus-26-train	KHA	طوكيو صفر تلاتة اربع تسعات أربعة خمسة ستة سبعة.
12240	corpus-6-test-corpus-26-train	KHA	ممكن تساعدني القي حديقة الحيوان؟
12246	corpus-6-test-corpus-26-train	KHA	ح توريني اضبطوا كيف؟
12247	corpus-6-test-corpus-26-train	KHA	حوالي الزمن كم جولة البص بتنتهي؟
12254	corpus-6-test-corpus-26-train	KHA	هل تعرف كيف تستخدم تلفون؟
12259	corpus-6-test-corpus-26-train	KHA	اكيد. عندنا بعض علامات الكتب أمريكية اصلية جميلة.
12298	corpus-6-test-corpus-26-train	KHA	مشغل مكالمات يتكلم ياباني، من فضلك.
12331	corpus-6-test-corpus-26-train	KHA	نحن مهتمين بالموضة.
12333	corpus-6-test-corpus-26-train	KHA	ممكن تديني مقطورة؟
12345	corpus-6-test-corpus-26-train	KHA	هل دا الكلنك إف؟
12364	corpus-6-test-corpus-26-train	KHA	اهلا، انسة ياماقوشي؟ الطرف التاني في الخط. مكالمتك اتقبلت. اتفضلي، من فضلك.
12391	corpus-6-test-corpus-26-test	KHA	وين ممكن اشتري تزكرة رفع قسيمة؟
12396	corpus-6-test-corpus-26-train	KHA	ياتو زمن ح نصل في لوس أنجلوس؟
12403	corpus-6-test-corpus-26-train	KHA	أمشي دغري لحوالي خمسة دقائق، و لف شمال.
12416	corpus-6-test-corpus-26-train	KHA	هو الشارع دا تجاه الشاطئ.
12420	corpus-6-test-corpus-26-train	KHA	الشاي العشبي دا بساعد في تجديد الجسم.
12421	corpus-6-test-corpus-26-train	KHA	دي ما مصنوعة في اليابان، ول لا؟
12443	corpus-6-test-corpus-26-train	KHA	كله تمام. الشارع دا من فضلك. ح اوديك لغرفتك.
12479	corpus-6-test-corpus-26-train	KHA	لازم أغادر الفندق قبل الظهر.
12495	corpus-6-test-corpus-26-train	KHA	اتنين هامبرقر و قهوتين، من فضلك. داير اشيلهم برة.
12510	corpus-6-test-corpus-26-train	KHA	ممكن أشيل الشنط دي؟
12527	corpus-6-test-corpus-26-train	KHA	طلبت لحم، ما سمك. ممكن تغير دا؟
12546	corpus-6-test-corpus-26-train	KHA	طفلي أتحذر تماما.
12551	corpus-6-test-corpus-26-train	KHA	أنا مريض للمعدة.
12556	corpus-6-test-corpus-26-train	KHA	الجاكيت دا ما مقاسي.
12557	corpus-6-test-corpus-26-train	KHA	داير أقابل مستر ويليام.
12560	corpus-6-test-corpus-26-train	KHA	عنده تشكيلة لسبعة فيتامينات و معادن.
12562	corpus-6-test-corpus-26-test	KHA	السن متروم.
12589	corpus-6-test-corpus-26-train	KHA	ممكن احصل علي إعادة المبلغ لم أرجع لليابان؟
12599	corpus-6-test-corpus-26-train	KHA	الصحن دا مصنوع من شنو؟
12603	corpus-6-test-corpus-26-train	KHA	أي بلد مصنوع فيها دا؟
12608	corpus-6-test-corpus-26-train	KHA	ممكن تعمله في عشرة دقائق؟
12611	corpus-6-test-corpus-26-dev	KHA	انا ما تمام في الإنجليزي. هل في أي زول هنا بتكلم ياباني؟
12615	corpus-6-test-corpus-26-train	KHA	وين ممكن احصل علي رمز النفق؟
12638	corpus-6-test-corpus-26-train	KHA	عشرين عينة إضافية ح يرسلوا ليك.
12644	corpus-6-test-corpus-26-train	KHA	ما أظن أن داك لي لأن بشرتي جافة شديد.
12650	corpus-6-test-corpus-26-train	KHA	ممكن احصل على جدول زمني، من فضلك؟
12658	corpus-6-test-corpus-26-dev	KHA	ايوة، أعتقد إني ح انتظر.
12671	corpus-6-test-corpus-26-train	KHA	تسعة وتسعين دولار للساعة للطفل.
12672	corpus-6-test-corpus-26-train	KHA	أنا آسف، نحن بعنا.
12677	corpus-6-test-corpus-26-train	KHA	لازم يكون هادئ.
12678	corpus-6-test-corpus-26-dev	KHA	عندى معداتي الخاصة.
12679	corpus-6-test-corpus-26-train	KHA	مفتاح غرفة، خمسة صفر تلاتة، من فضلك.
12699	corpus-6-test-corpus-26-test	KHA	ياتو زمن ترمنال مان بكون معروض؟
12701	corpus-6-test-corpus-26-train	KHA	وين مصففين الشعر؟
12708	corpus-6-test-corpus-26-train	KHA	عند الساعة سبعة، من فضلك.
12712	corpus-6-test-corpus-26-train	KHA	شنطتي اتدمرت.
12713	corpus-6-test-corpus-26-train	KHA	سياحة.
12732	corpus-6-test-corpus-26-train	KHA	انا جيت من اسبانيا.
12750	corpus-6-test-corpus-26-dev	KHA	في حاجة غلط في مفتاح البطاقة. ممكن تديني واحد تاني، من فضلك؟
12755	corpus-6-test-corpus-26-dev	KHA	عندي طفح في اذرعي.
12761	corpus-6-test-corpus-26-train	KHA	رسل دي جويا لليابان، من فضلك.
12766	corpus-6-test-corpus-26-test	KHA	وين أقرب صيدلية؟
12770	corpus-6-test-corpus-26-dev	KHA	خمرة تانية، من فضلك.
12773	corpus-6-test-corpus-26-train	KHA	ناس ودودين جدا.
12776	corpus-6-test-corpus-26-test	KHA	كم مشروب متضمن في السعر؟
12777	corpus-6-test-corpus-26-test	KHA	انت عملتها.
12782	corpus-6-test-corpus-26-train	KHA	وين باب الإيواء للرحلة دي؟
12790	corpus-6-test-corpus-26-test	KHA	إذا في واحد متاح، ممكن تحجز طربيزة جنب الشباك؟
12805	corpus-6-test-corpus-26-dev	KHA	اعلانات الأربعاء كانت اساسا معمولة؟
12810	corpus-6-test-corpus-26-train	KHA	نحن في ارتفاع اتناشر ألف قدم.
12820	corpus-6-test-corpus-26-train	KHA	أولا، دايرين نشوف وول استريت.
12822	corpus-6-test-corpus-26-train	KHA	وين موقف البص لاكسفورد؟
12823	corpus-6-test-corpus-26-train	KHA	ح انتظر لغاية الشرفة تكون متاحة.
12835	corpus-6-test-corpus-26-train	KHA	ممكن نشوف بعض المحافظ جلدية؟
12861	corpus-6-test-corpus-26-dev	KHA	خلينا نشاهد التلفزيون. في لعبة بيسبول شغالة.
12878	corpus-6-test-corpus-26-train	KHA	ممكن تكتب عنوانك هنا؟
12884	corpus-6-test-corpus-26-train	KHA	من فضلك وريني وين أقرب صيدلية.
12903	corpus-6-test-corpus-26-train	KHA	لفندقي، من فضلك. عنوان فندقي هنا.
12905	corpus-6-test-corpus-26-dev	KHA	كم ولاية هناك بجانب طوكيو؟
12917	corpus-6-test-corpus-26-train	KHA	علق و انتظر لفترة من فضلك.
12936	corpus-6-test-corpus-26-train	KHA	انت عادة بتعمل شنو في البيت بعد العشاء؟
12941	corpus-6-test-corpus-26-train	KHA	بالتأكيد. متين داير تلعب قولف؟
12945	corpus-6-test-corpus-26-train	KHA	هي ح تكون في البيت حوالي تلاتة.
12952	corpus-6-test-corpus-26-train	KHA	داير اتصل بالسفارة اليابانية.
12968	corpus-6-test-corpus-26-train	KHA	زيادة شوية.
12969	corpus-6-test-corpus-26-train	KHA	من وين بتغادر بصات معالم المدينة؟
12973	corpus-6-test-corpus-26-train	KHA	كم بتشحن لارسالهم لليابان؟
12976	corpus-6-test-corpus-26-dev	KHA	ما عندي أندية أو أحذية.
13015	corpus-6-test-corpus-26-train	KHA	هل الين الياباني تمام؟
13022	corpus-6-test-corpus-26-train	KHA	هل عندك موستاج؟
13027	corpus-6-test-corpus-26-train	KHA	نحن ح ننط من هنا؟
13069	corpus-6-test-corpus-26-train	KHA	مستر كاواي، عندنا طربيزة ليك الآن. تعال من هنا، من فضلك.
13072	corpus-6-test-corpus-26-train	KHA	بالتأكيد. أمشي بالسلالم تحت هناك و ح تشوف بعض التعليمات. بس تابعهم.
13075	corpus-6-test-corpus-26-dev	KHA	مكتب الاستقبال. ممكن اساعدك؟
13076	corpus-6-test-corpus-26-train	KHA	ممكن تنزلني في فندق الهلتون، من فضلك؟
13077	corpus-6-test-corpus-26-dev	KHA	هل انت غالبا عليك ان تعمل متأخر؟
13090	corpus-6-test-corpus-26-dev	KHA	اسف جدا، لكن لكن ما عندنا تاني. كيف عن أوراق انجليزية؟
13095	corpus-6-test-corpus-26-train	KHA	طربيزة لغير المدخنين، من فضلك.
13096	corpus-6-test-corpus-26-train	KHA	ممكن تخليني أعرف قبل نصل دورام؟
13113	corpus-6-test-corpus-26-test	KHA	دا فريش؟
13116	corpus-6-test-corpus-26-train	KHA	ما صاح. انت دائما بتعاملني.
13118	corpus-6-test-corpus-26-dev	KHA	ممكن أوريك بعض الفساتين؟
13126	corpus-6-test-corpus-26-train	KHA	اتهجاه، من فضلك.
13133	corpus-6-test-corpus-26-train	KHA	أنا أصبحت سكران بالخمرة.
13134	corpus-6-test-corpus-26-train	KHA	خلي بالك لأن الجو متغير شديد في الجبال.
13159	corpus-6-test-corpus-26-train	KHA	شيك سياحي و ين ياباني، اوكي؟
13162	corpus-6-test-corpus-26-train	KHA	آسف، انا اتحققت من خدمة الغرف وقسم المفقودات. ما موجود عندهم.
13172	corpus-6-test-corpus-26-train	KHA	انه مكان صعب لايجاده. إنه في طريق سريع في مين هايوي.
13183	corpus-6-test-corpus-26-train	KHA	ما بعرف شي عنه.
13184	corpus-6-test-corpus-26-train	KHA	ممكن نناقشه في مقهى.
13188	corpus-6-test-corpus-26-train	KHA	شايف، في الحالة ديك انا ما على دفع سعر التعديلات، صاح؟
13202	corpus-6-test-corpus-26-train	KHA	مشغل المكالمات، من فضلك.
13262	corpus-6-test-corpus-26-train	KHA	ممكن توطي السرج، من فضلك؟
13264	corpus-6-test-corpus-26-dev	KHA	هل ح حتستضيفني عندك الليلة؟
13267	corpus-6-test-corpus-26-train	KHA	أوكي. ح اخد فقط دقيقتين. شكرا ليك.
13268	corpus-6-test-corpus-26-train	KHA	دي فاتورتك. تلتمية وسبعة وتسعين دولار.
13269	corpus-6-test-corpus-26-train	KHA	انت محظوظ.
13287	corpus-6-test-corpus-26-train	KHA	من فضلك خليها طربيزة مع منظر ليلى جيد.
13290	corpus-6-test-corpus-26-train	KHA	هل دا صنع آلي ول صنع يدوي؟
13291	corpus-6-test-corpus-26-train	KHA	داير أأجر النوع دا من العربية لأربع وعشرين ساعة.
13306	corpus-6-test-corpus-26-train	KHA	كان جميل جدا الاقيك.
13322	corpus-6-test-corpus-26-train	KHA	إنه ممزق.
13333	corpus-6-test-corpus-26-dev	KHA	تمام الآن، خلينا نعاين ليك.
13347	corpus-6-test-corpus-26-train	KHA	طب، ب س فكر كم من الزمن شغله ح ياخد لو هو سأل سؤال واحد إضافي لكل شخص. ياللا، خلينا نسرع و نحصل على عفشنا. ومفروض نمشي لاجراءات الجمارك.
13396	corpus-6-test-corpus-26-train	KHA	الوزن كم؟
13399	corpus-6-test-corpus-26-train	KHA	هل هناك كافيتريا صينية حوالي هنا؟
13407	corpus-6-test-corpus-26-train	KHA	رصيف خمسة هناك.
13408	corpus-6-test-corpus-26-train	KHA	متين ح تبدأ لعبة السوكر؟
13423	corpus-6-test-corpus-26-dev	KHA	هو خارج الطلب. ممكن تراجع كاميرتي؟
13424	corpus-6-test-corpus-26-test	KHA	قهوة بكريم و سكر، من فضلك.
13436	corpus-6-test-corpus-26-train	KHA	أعتقد أنه في بعض الأخطاء في الفاتورة.
13438	corpus-6-test-corpus-26-train	KHA	من فضلك أديني الواحد داك.
13440	corpus-6-test-corpus-26-train	KHA	إنها البوابة سبعة.
13444	corpus-6-test-corpus-26-train	KHA	هل انت اسكتلندي؟
13446	corpus-6-test-corpus-26-train	KHA	تلاتة-اتنين-واحد-اتنين. انتظر ثانية، كله تمام؟ داير أرسل ليك حاجة هنا. أعذرني.
13471	corpus-6-test-corpus-26-test	KHA	مئة و خمسة وتلاتين ين للدولار.
13476	corpus-6-test-corpus-26-train	KHA	فساتين قصيرة مع بوت ما ح تطلع برة الموضة أبدا.
13477	corpus-6-test-corpus-26-train	KHA	ممكن اتكلم مع المدير؟
13480	corpus-6-test-corpus-26-train	KHA	لي اجرتك مخالفة للعداد؟
13484	corpus-6-test-corpus-26-train	KHA	ممكن اشوف الواحد دا؟
13487	corpus-6-test-corpus-26-train	KHA	وعدت نفسي أن لم اشوفك، ح أعرفك.
13488	corpus-6-test-corpus-26-train	KHA	البحصل شنو متأخر؟
13492	corpus-6-test-corpus-26-train	KHA	ما حاسي كويس. ممكن تقترح طبيب؟
13504	corpus-6-test-corpus-26-train	KHA	الطرف التاني في الخط. اتفضل.
13515	corpus-6-test-corpus-26-train	KHA	هل هناك عرض طابق؟
13528	corpus-6-test-corpus-26-dev	KHA	الحمام ما بدفق.
13532	corpus-6-test-corpus-26-dev	KHA	كم من الزمن بتاخد من هنا للسيتي هول بالارجل؟
13547	corpus-6-test-corpus-26-train	KHA	اخد الدواء دا بعد كل وجبة لمن يوجع شديد.
13550	corpus-6-test-corpus-26-train	KHA	انت بتخت القروش في ظرف خاص مزخرف البسموه شوقيبوكورو.
13553	corpus-6-test-corpus-26-train	KHA	في زول اتاذي.
13609	corpus-6-test-corpus-26-test	KHA	أنا متعجب مفروض اجيب ليه شنو؟
13624	corpus-6-test-corpus-26-train	KHA	هل عندك خريطة للمترو؟
13629	corpus-6-test-corpus-26-train	KHA	عندي غرفة جاهزة ليك في القراند هوتل. ممكن تمشي هناك؟
13635	corpus-6-test-corpus-26-train	KHA	عندي وجع في عيني اليمين.
13657	corpus-6-test-corpus-26-train	KHA	انا ما كويس جدا في الألماني.
13660	corpus-6-test-corpus-26-train	KHA	نحن بالتأكيد مفروض نرجع سواء تاني.
13666	corpus-6-test-corpus-26-train	KHA	ممكن تضيق السروال دا؟
13682	corpus-6-test-corpus-26-train	KHA	ممكن استعير مضارب و كورة؟
13685	corpus-6-test-corpus-26-test	KHA	ممكن تحط شوية فكة؟
13694	corpus-6-test-corpus-26-train	KHA	ممكن احصل على نص دورق؟
13707	corpus-6-test-corpus-26-train	KHA	هاي. انا جن.
13717	corpus-6-test-corpus-26-train	KHA	ناكاي.
13719	corpus-6-test-corpus-26-train	KHA	هل تمانع إذا اخدت صورة ليك و لتكسيك؟
13733	corpus-6-test-corpus-26-train	KHA	اتصلت عن شنطة ضايعة قبل تلاتة أيام.
13748	corpus-6-test-corpus-26-test	KHA	داير فندق ارخص.
13755	corpus-6-test-corpus-26-dev	KHA	اوه، هناك حاجات كتيرة مفروض تشوفها في قرينوتش فيليج.
13769	corpus-6-test-corpus-26-train	KHA	في العمل. عندي أتصال عمل هناك.
13783	corpus-6-test-corpus-26-train	KHA	هو بطابق بدلتك.
13784	corpus-6-test-corpus-26-train	KHA	ممكن من فضلك تخلي بالك لشنطتي؟
13788	corpus-6-test-corpus-26-train	KHA	كيف بتحب الفكرة دي؟ نحن بنقبل ظرفك بتاع ستة شهور ملاحظة قدمت انك ضمنت لينا الحق للبيع لستة شهور بعد انتهاء العقد.
13803	corpus-6-test-corpus-26-train	KHA	أعذرني. هل أنت بتعرف نيويورك كويس؟
13824	corpus-6-test-corpus-26-test	KHA	ح ننتظر. من فضلك كلمنا لم تجهز.
13827	corpus-6-test-corpus-26-train	KHA	داير أقابل جراح.
13828	corpus-6-test-corpus-26-dev	KHA	هل ديل مكونات طبيعية؟
13831	corpus-6-test-corpus-26-train	KHA	داير اركب عربية رياضية.
13843	corpus-6-test-corpus-26-train	KHA	كود المنطقة صفر تلاتة. الرقم تلاتة واحد تلاتة أربعة خمسة ستة سبعة.
13854	corpus-6-test-corpus-26-train	KHA	هو عانى من نزلة.
13856	corpus-6-test-corpus-26-test	KHA	ميثاق ثانوي ح يكون الأحسن.
13862	corpus-6-test-corpus-26-train	KHA	داير أرسل التسليم العام دا.
13903	corpus-6-test-corpus-26-train	KHA	خليني احول المكالمة دي للزول المسؤول.
13913	corpus-6-test-corpus-26-train	KHA	ياتو مقاس انت داير؟
13919	corpus-6-test-corpus-26-train	KHA	اوه، عزيزي. ما لاحظت اني ما زلت عندي ديلك.
13920	corpus-6-test-corpus-26-train	KHA	هل عندك صناديق لحزم الارسال؟
13921	corpus-6-test-corpus-26-train	KHA	هل الخطوط الجوية ح تدفع لفندقي و تكاليف الوجبة؟
13938	corpus-6-test-corpus-26-train	KHA	هل ديل كلهم شنطك؟
13942	corpus-6-test-corpus-26-train	KHA	كيف تتمني تعمل المكالمة؟
13946	corpus-6-test-corpus-26-train	KHA	تمام، هو غالي. ما مصنوع في اليابان، ول لا؟
13953	corpus-6-test-corpus-26-train	KHA	ممكن من فضلك تمرر لي الملح؟
13966	corpus-6-test-corpus-26-train	KHA	وين أقرب كافيتريا من الفندق دا؟
13993	corpus-6-test-corpus-26-train	KHA	داير شامبو لشعر طبيعي.
14008	corpus-6-test-corpus-26-train	KHA	متين بتعتقد ح يتلقي؟
14014	corpus-6-test-corpus-26-train	KHA	بتمنى ليك سنة جديدة سعيدة.
14018	corpus-6-test-corpus-26-train	KHA	ح يكون عندي اسبرايت كبير.
14043	corpus-6-test-corpus-26-test	KHA	من فضلك قوله تاني ببطء أكتر.
14045	corpus-6-test-corpus-26-train	KHA	أعذرني. داير أضع طلب.
14059	corpus-6-test-corpus-26-test	KHA	عندنا جمبري نيوبيرق و رجل حمل مشوي.
14069	corpus-6-test-corpus-26-train	KHA	داير غرفة لمنظر جميل.
14074	corpus-6-test-corpus-26-train	KHA	تلاتة قزازات بتاعت عصير بطيخ، من فضلك.
14086	corpus-6-test-corpus-26-train	KHA	عندي تلاتة أطفال.
14088	corpus-6-test-corpus-26-train	KHA	أمشي دغري بالهول دا و لف شمال في الكورنة. ح تشوفه في يمينك.
14089	corpus-6-test-corpus-26-dev	KHA	هل هي جولة يوم كامل؟
14094	corpus-6-test-corpus-26-train	KHA	كم بتكلف تزكرة ذهاب واياب لاكسفورد؟
14098	corpus-6-test-corpus-26-train	KHA	بمشي لنادي رياضي كل يومين.
14099	corpus-6-test-corpus-26-train	KHA	وين ممكن اقعد خلال الجولة؟
14104	corpus-6-test-corpus-26-train	KHA	متين زمن الخروج؟
14108	corpus-6-test-corpus-26-train	KHA	كم رسوم المرشد لليوم؟
14120	corpus-6-test-corpus-26-train	KHA	وين ممكن ألقى سيديهات؟
